{
  "$schema": "./scenes.schema.json",
  "file_kind": "nazar_scenes",
  "version": "2026.10.0",
  "status": "draft",
  "licence": "CC-BY-4.0",
  "attribution": "Margdarshak content pack, team Chanakya (Nestiq Private Limited), 2026",
  "notes": "ADR-0013: scene catalogue for the AI-generated Nazar clip bank (hackathon build). Every scene is fictional and is rendered by a video model with the guardrails of ai/prompts/clip_generator.md; every clip is labelled AI-generated and SynthID-watermarked. Nominal onsets are hints for raters; two human raters set every scoring window. Hindi cue text pending native review.",
  "promptId": "PRM-CLIPGEN",
  "promptVersion": "1.0.0",
  "disclosure": "ai_generated",
  "hi_review_status": "pending_native_review",
  "scenes": [
    {
      "sceneId": "SCN-001",
      "revision": 1,
      "hazardType": "bus_stop_pedestrian",
      "pov": "2W",
      "setting": "metro_arterial",
      "roadType": "urban_arterial",
      "region": "Indian metro",
      "tenantTags": ["JK", "KL"],
      "timeOfDay": "day",
      "weather": "clear",
      "speedKmh": 30,
      "leadInS": 12,
      "targetDurationS": 30,
      "scene": "A wide four-lane city road with a painted median, shops set back behind a footpath, light mixed traffic of cars, scooters and auto-rickshaws.",
      "shots": [
        {
          "kind": "opening",
          "durationS": 8,
          "prompt": "The scooter rides in the left lane behind a hatchback at a steady distance. Shop awnings and trees pass on the left."
        },
        {
          "kind": "extension",
          "durationS": 6,
          "prompt": "Ahead on the left, a plain white city bus without any markings slows and stops at a roofed bus shelter. The scooter keeps its lane, a little to the right of the bus."
        },
        {
          "kind": "extension",
          "durationS": 8,
          "prompt": "As the scooter draws level with the rear of the stopped bus, a pair of feet becomes visible under the front of the bus. A young man in a grey shirt then steps out from in front of the bus towards the road, looking the other way.",
          "hazardBegins": true,
          "cueAtS": 2
        },
        {
          "kind": "extension",
          "durationS": 8,
          "prompt": "The scooter eases off and slows well before him. The man notices, steps back to the bus's edge and waits; the scooter passes slowly and the road ahead is clear."
        }
      ],
      "cue": {
        "en": "Feet visible under the front of the stopped bus",
        "hi": "रुकी बस के आगे के हिस्से के नीचे पैर दिख रहे हैं"
      },
      "difficulty": 3,
      "occlusion": true
    },
    {
      "sceneId": "SCN-002",
      "revision": 1,
      "hazardType": "bus_stop_pedestrian",
      "pov": "4W",
      "setting": "kerala_town",
      "roadType": "urban_arterial",
      "region": "Kerala",
      "tenantTags": ["KL"],
      "timeOfDay": "day",
      "weather": "rain",
      "speedKmh": 25,
      "leadInS": 14,
      "targetDurationS": 30,
      "scene": "A two-lane town road in a green Kerala town with coconut palms, tiled roofs and small shop fronts without readable boards; people with umbrellas on the footpath.",
      "shots": [
        {
          "kind": "opening",
          "durationS": 8,
          "prompt": "The car drives slowly behind a scooter rider in a raincoat; wipers sweep the windscreen and puddles reflect the shops."
        },
        {
          "kind": "extension",
          "durationS": 8,
          "prompt": "On the left, a plain cream-coloured bus without markings stands at a stop with its door open. The scooter ahead turns off into a side lane, leaving the lane clear."
        },
        {
          "kind": "extension",
          "durationS": 8,
          "prompt": "Close to the bus's front corner, the tip of a black umbrella and then a woman's sandals appear. She steps off the kerb in front of the bus, umbrella low, without looking.",
          "hazardBegins": true,
          "cueAtS": 2
        },
        {
          "kind": "extension",
          "durationS": 6,
          "prompt": "The car slows to a crawl and holds back; the woman crosses to the median and the car moves on gently."
        }
      ],
      "cue": {
        "en": "An umbrella tip and sandals at the bus's front corner",
        "hi": "बस के आगे के कोने पर छाते की नोक और चप्पलें"
      },
      "difficulty": 4,
      "occlusion": true
    },
    {
      "sceneId": "SCN-003",
      "revision": 1,
      "hazardType": "door_opening",
      "pov": "2W",
      "setting": "kerala_town",
      "roadType": "market_street",
      "region": "Kerala",
      "tenantTags": ["KL"],
      "timeOfDay": "day",
      "weather": "overcast",
      "speedKmh": 20,
      "leadInS": 12,
      "targetDurationS": 30,
      "scene": "A narrow market street in a Kerala town, a row of parked cars along the left kerb, fruit stalls and tiled roofs behind them, a few pedestrians on the edge.",
      "shots": [
        {
          "kind": "opening",
          "durationS": 8,
          "prompt": "The scooter rides slowly along the street, keeping about one door's width from the parked cars on the left."
        },
        {
          "kind": "extension",
          "durationS": 6,
          "prompt": "A parked silver sedan ahead has a driver sitting inside; his head turns and his hand rises to the door handle."
        },
        {
          "kind": "extension",
          "durationS": 8,
          "prompt": "The sedan's driver door starts to swing open into the scooter's path, the gap at its edge widening.",
          "hazardBegins": true,
          "cueAtS": 1
        },
        {
          "kind": "extension",
          "durationS": 8,
          "prompt": "The scooter has already eased off and moved slightly right; the driver sees it, holds the door half open and waits. The scooter passes and the street continues."
        }
      ],
      "cue": {
        "en": "The driver in a parked car reaches for the door handle",
        "hi": "खड़ी कार में बैठा ड्राइवर दरवाज़े के हैंडल की ओर हाथ बढ़ाता है"
      },
      "difficulty": 3,
      "occlusion": false
    },
    {
      "sceneId": "SCN-004",
      "revision": 1,
      "hazardType": "door_opening",
      "pov": "4W",
      "setting": "metro_residential",
      "roadType": "residential_lane",
      "region": "Indian metro",
      "tenantTags": ["JK", "KL"],
      "timeOfDay": "dusk",
      "weather": "clear",
      "speedKmh": 20,
      "leadInS": 13,
      "targetDurationS": 30,
      "scene": "A tree-lined residential lane in a large Indian city at dusk, apartment gates on both sides, cars parked along the right edge, street lights coming on.",
      "shots": [
        {
          "kind": "opening",
          "durationS": 8,
          "prompt": "The car moves slowly down the lane with its headlights on; a man walks a dog on the far side."
        },
        {
          "kind": "extension",
          "durationS": 7,
          "prompt": "Ahead on the right, a parked taxi without markings has its brake lights flick on and its interior light comes on."
        },
        {
          "kind": "extension",
          "durationS": 7,
          "prompt": "The taxi's rear door begins to open into the lane and a passenger's leg appears.",
          "hazardBegins": true,
          "cueAtS": 1
        },
        {
          "kind": "extension",
          "durationS": 8,
          "prompt": "The car slows and keeps to the left; the passenger steps out and closes the door. The car continues down the lane."
        }
      ],
      "cue": {
        "en": "The interior light comes on in a parked taxi",
        "hi": "खड़ी टैक्सी के अंदर की लाइट जलती है"
      },
      "difficulty": 3,
      "occlusion": false
    },
    {
      "sceneId": "SCN-005",
      "revision": 1,
      "hazardType": "auto_cut_in",
      "pov": "2W",
      "setting": "metro_arterial",
      "roadType": "urban_arterial",
      "region": "Indian metro",
      "tenantTags": ["JK", "KL"],
      "timeOfDay": "day",
      "weather": "clear",
      "speedKmh": 30,
      "leadInS": 12,
      "targetDurationS": 30,
      "scene": "A busy six-lane city road with a metro viaduct overhead on concrete pillars, cars and auto-rickshaws in all lanes.",
      "shots": [
        {
          "kind": "opening",
          "durationS": 8,
          "prompt": "The scooter rides in the middle lane behind a small van, keeping a steady gap."
        },
        {
          "kind": "extension",
          "durationS": 6,
          "prompt": "In the left lane, a green and yellow auto-rickshaw without any markings drifts close to the lane line; its front wheel turns slightly towards the scooter's lane."
        },
        {
          "kind": "extension",
          "durationS": 8,
          "prompt": "The auto-rickshaw swings into the gap in front of the scooter without signalling, to pick up a passenger waving from the right.",
          "hazardBegins": true,
          "cueAtS": 1
        },
        {
          "kind": "extension",
          "durationS": 8,
          "prompt": "The scooter has already eased off and leaves room; the auto-rickshaw settles in front and slows. The scooter keeps its distance behind it."
        }
      ],
      "cue": {
        "en": "An auto-rickshaw's front wheel turns towards your lane",
        "hi": "ऑटो-रिक्शा का अगला पहिया आपकी लेन की ओर मुड़ता है"
      },
      "difficulty": 2,
      "occlusion": false
    },
    {
      "sceneId": "SCN-006",
      "revision": 1,
      "hazardType": "auto_cut_in",
      "pov": "4W",
      "setting": "small_town_market",
      "roadType": "market_street",
      "region": "North Indian town",
      "tenantTags": ["JK", "KL"],
      "timeOfDay": "dusk",
      "weather": "clear",
      "speedKmh": 25,
      "leadInS": 14,
      "targetDurationS": 30,